{
  "logic": [
    "Delete a row. Return 404 if it does not exist.",
    "List rows with an optional exact string filter, limit, and offset in id order.",
    "Create a row. Return 409 for a unique value conflict.",
    "Update supplied fields. Return 404 if the row does not exist.",
    "Get a row by id. Return 404 if it does not exist."
  ],
  "migration": {
    "down_revision": null,
    "revision": "rev1000"
  },
  "package": "items",
  "query": {
    "filter_field": "title",
    "max_limit": 20
  },
  "resource": {
    "fields": [
      {
        "name": "title",
        "required": true,
        "type": "str",
        "unique": false
      }
    ],
    "name": "Item",
    "path": "/items",
    "table": "items"
  },
  "tests": [
    "Check CRUD, exact filtering, page bounds, missing id, and unique conflict when supported."
  ],
  "version": "som.prompt.v2"
}
